{
  "schema_version": 1,
  "status": "SAMPLE-DRAFT",
  "scope": "P2 Song-life activity matrix",
  "entries": [
    {
      "binding_id": "ACT-BIND-01",
      "activity_id": "EVT-018",
      "episode_id": "S1-E01",
      "arc_id": "ARC-01",
      "activity": "修匣与补伞的旧物修复",
      "historical_anchor": "沿用扩展库 EVT-018 的宋代城市生活形态；具体人物冲突为本剧解释。",
      "interpretation_note": "活动形态取自既有宋代生活活动库，人物选择、具体摊位与冲突属于本剧虚构，不改动 Canon 城市骨架。",
      "season_and_location": {
        "episode_window": [
          "S1-E01"
        ],
        "location_ids": [
          "LOC-001",
          "LOC-002"
        ]
      },
      "modern_emotional_entry": "修复而非丢弃、手艺尊严与旧物承载的关系记忆",
      "lead_characters": [
        "CHR-A1-02",
        "CHR-B-006",
        "CHR-B-003"
      ],
      "relationship_ids": [
        "REL-005",
        "REL-001"
      ],
      "surface_goal": "修匣与补伞的旧物修复",
      "obstacle": "修匣匠只愿说手艺、不愿卷入亡父旧案",
      "relationship_delta": "沈蘅把修补痕迹从家务细节升级为时间证据",
      "clue_delta": "修匣匠要求先写‘见过’而不是‘知道’",
      "choice": "‘这是旧东西，补丁却是新的。’",
      "state_transfer": "沈蘅不再把后仓当纯粹家内空间",
      "continuity_cost": "活动结束后保留人物关系余波、物件或记录状态，不能回到活动前。",
      "opening_hook": "补匣动作让母女都看见‘保存’并不等于‘不改变’",
      "ending_button": "修补痕迹进入未核记录"
    },
    {
      "binding_id": "ACT-BIND-02",
      "activity_id": "EVT-002",
      "episode_id": "S1-E02",
      "arc_id": "ARC-01",
      "activity": "夜市食担与小吃接力",
      "historical_anchor": "沿用扩展库 EVT-002 的宋代城市生活形态；具体人物冲突为本剧解释。",
      "interpretation_note": "活动形态取自既有宋代生活活动库，人物选择、具体摊位与冲突属于本剧虚构，不改动 Canon 城市骨架。",
      "season_and_location": {
        "episode_window": [
          "S1-E02"
        ],
        "location_ids": [
          "LOC-001",
          "LOC-005"
        ]
      },
      "modern_emotional_entry": "食品价格、服务劳动、探店欲望与看不见的供应链",
      "lead_characters": [
        "CHR-L2-02",
        "CHR-L1-01",
        "CHR-B-007"
      ],
      "relationship_ids": [
        "REL-005"
      ],
      "surface_goal": "夜市食担与小吃接力",
      "obstacle": "摊主怕说少一碗会被当成涨价或偷工",
      "relationship_delta": "阿沅的生活观察获得沈蘅的待核标记",
      "clue_delta": "阿沅先记录四日再把话说满",
      "choice": "三处摊子的同样食材都少了一点",
      "state_transfer": "阿沅开始坚持亲自回访而非只报纸面",
      "continuity_cost": "活动结束后保留人物关系余波、物件或记录状态，不能回到活动前。",
      "opening_hook": "沈蘅把‘少吃’与供应链连接，但不把人变成数字",
      "ending_button": "生活基线成为下一次合报的入口"
    },
    {
      "binding_id": "ACT-BIND-03",
      "activity_id": "EVT-003",
      "episode_id": "S1-E03",
      "arc_id": "ARC-01",
      "activity": "瓦舍说书与曲词改写",
      "historical_anchor": "沿用扩展库 EVT-003 的宋代城市生活形态；具体人物冲突为本剧解释。",
      "interpretation_note": "活动形态取自既有宋代生活活动库，人物选择、具体摊位与冲突属于本剧虚构，不改动 Canon 城市骨架。",
      "season_and_location": {
        "episode_window": [
          "S1-E03"
        ],
        "location_ids": [
          "LOC-006",
          "LOC-009"
        ]
      },
      "modern_emotional_entry": "内容创作、粉丝扩散、舆论节奏与作品归属",
      "lead_characters": [
        "CHR-L1-02",
        "CHR-A1-04",
        "CHR-L1-03"
      ],
      "relationship_ids": [
        "REL-003",
        "REL-002"
      ],
      "surface_goal": "瓦舍说书与曲词改写",
      "obstacle": "班主要求柳十四照旧词唱，贵客的赏钱绑在安抚效果上",
      "relationship_delta": "柳十四改曲，传播链第一次被人为打断",
      "clue_delta": "柳把后台改词交给沈蘅，承认舞台动作也是证据",
      "choice": "同一句还未唱出的词先被三桌客人说出",
      "state_transfer": "顾念娘将当晚损失记入春台账而不抹掉柳的署名",
      "continuity_cost": "活动结束后保留人物关系余波、物件或记录状态，不能回到活动前。",
      "opening_hook": "柳十四失去贵客契约但保留听众判断空间",
      "ending_button": "传播异常从耳语变成可追踪行为"
    },
    {
      "binding_id": "ACT-BIND-04",
      "activity_id": "EVT-017",
      "episode_id": "S1-E04",
      "arc_id": "ARC-01",
      "activity": "书坊刻版与地图复核",
      "historical_anchor": "沿用扩展库 EVT-017 的宋代城市生活形态；具体人物冲突为本剧解释。",
      "interpretation_note": "活动形态取自既有宋代生活活动库，人物选择、具体摊位与冲突属于本剧虚构，不改动 Canon 城市骨架。",
      "season_and_location": {
        "episode_window": [
          "S1-E04"
        ],
        "location_ids": [
          "LOC-008",
          "LOC-013"
        ]
      },
      "modern_emotional_entry": "内容版权、转载署名与断章取义",
      "lead_characters": [
        "CHR-L1-03",
        "CHR-A2-07",
        "CHR-A2-08"
      ],
      "relationship_ids": [
        "REL-002",
        "REL-011"
      ],
      "surface_goal": "书坊刻版与地图复核",
      "obstacle": "书坊只想交付可卖的整齐版本，工匠不愿承担地图错误",
      "relationship_delta": "周砚之保留错误线并允许方书娘改图",
      "clue_delta": "周先说比例不确定，再让工匠指出渠壁接缝",
      "choice": "新版地图少了一条真实存在的支渠",
      "state_transfer": "后来所有地图必须保留版本与更正痕迹",
      "continuity_cost": "活动结束后保留人物关系余波、物件或记录状态，不能回到活动前。",
      "opening_hook": "周失去一次独署机会，但地图获得可修正性",
      "ending_button": "空间异常指向城外仓区排水"
    },
    {
      "binding_id": "ACT-BIND-05",
      "activity_id": "EVT-020",
      "episode_id": "S1-E05",
      "arc_id": "ARC-01",
      "activity": "水上茶摊与船户交易",
      "historical_anchor": "沿用扩展库 EVT-020 的宋代城市生活形态；具体人物冲突为本剧解释。",
      "interpretation_note": "活动形态取自既有宋代生活活动库，人物选择、具体摊位与冲突属于本剧虚构，不改动 Canon 城市骨架。",
      "season_and_location": {
        "episode_window": [
          "S1-E05"
        ],
        "location_ids": [
          "LOC-010",
          "LOC-011",
          "LOC-012"
        ]
      },
      "modern_emotional_entry": "物流中间人、现金流、熟人交易与合同风险",
      "lead_characters": [
        "CHR-L1-04",
        "CHR-B-019",
        "CHR-L1-05"
      ],
      "relationship_ids": [
        "REL-004",
        "REL-001"
      ],
      "surface_goal": "水上茶摊与船户交易",
      "obstacle": "船帮旧人把所有异常归因于裴九娘旧失信",
      "relationship_delta": "裴九娘先交水路记录，阻止顾行舟替她辩护",
      "clue_delta": "她让脚夫先说身体记忆，再补自己的旧账",
      "choice": "船户把‘到达’改成‘看见船’",
      "state_transfer": "青鹞被列入后续查验名单",
      "continuity_cost": "活动结束后保留人物关系余波、物件或记录状态，不能回到活动前。",
      "opening_hook": "裴选择证据先行而不是先洗清名声",
      "ending_button": "水信与香信第一次闭合"
    },
    {
      "binding_id": "ACT-BIND-06",
      "activity_id": "EVT-023",
      "episode_id": "S1-E06",
      "arc_id": "ARC-01",
      "activity": "儿童纸鸢与街巷游戏",
      "historical_anchor": "沿用扩展库 EVT-023 的宋代城市生活形态；具体人物冲突为本剧解释。",
      "interpretation_note": "活动形态取自既有宋代生活活动库，人物选择、具体摊位与冲突属于本剧虚构，不改动 Canon 城市骨架。",
      "season_and_location": {
        "episode_window": [
          "S1-E06"
        ],
        "location_ids": [
          "LOC-001",
          "LOC-015"
        ]
      },
      "modern_emotional_entry": "儿童视角、家庭陪伴与被忽略的小观察",
      "lead_characters": [
        "CHR-B-004",
        "CHR-B-019",
        "CHR-L1-01"
      ],
      "relationship_ids": [
        "REL-G01"
      ],
      "surface_goal": "儿童纸鸢与街巷游戏",
      "obstacle": "大人认为孩子的空间记忆只是游戏，不愿写入记录",
      "relationship_delta": "沈蘅把孩子说的地点标作亲见、而非笑话",
      "clue_delta": "阿七先想替孩子解释，孩子反过来纠正他",
      "choice": "纸鸢一直飞向地图上不存在的渠",
      "state_transfer": "沈蘅接受未来会被普通人纠正",
      "continuity_cost": "活动结束后保留人物关系余波、物件或记录状态，不能回到活动前。",
      "opening_hook": "五信汇总多了一个不带解释的普通节点",
      "ending_button": "民间观察不再只由五位核心人物提供"
    },
    {
      "binding_id": "ACT-BIND-07",
      "activity_id": "EVT-022",
      "episode_id": "S1-E07",
      "arc_id": "ARC-02",
      "activity": "画舫雅集与棋局",
      "historical_anchor": "沿用扩展库 EVT-022 的宋代城市生活形态；具体人物冲突为本剧解释。",
      "interpretation_note": "活动形态取自既有宋代生活活动库，人物选择、具体摊位与冲突属于本剧虚构，不改动 Canon 城市骨架。",
      "season_and_location": {
        "episode_window": [
          "S1-E07"
        ],
        "location_ids": [
          "LOC-007",
          "LOC-009"
        ]
      },
      "modern_emotional_entry": "圈层社交、职场饭局与输赢背后的权力交换",
      "lead_characters": [
        "CHR-L3-01",
        "CHR-L1-01",
        "CHR-L2-04"
      ],
      "relationship_ids": [
        "REL-001",
        "REL-012"
      ],
      "surface_goal": "画舫雅集与棋局",
      "obstacle": "棋局主人把物流难题当成胜负，不愿让外行插话",
      "relationship_delta": "宋用一局棋和一批储备同时证明集中决策的速度",
      "clue_delta": "沈蘅承认有效，却追问输棋后谁能改局",
      "choice": "少一枚棋子却没人承认拿走",
      "state_transfer": "沈蘅下一次不能把宋简单写成反派",
      "continuity_cost": "活动结束后保留人物关系余波、物件或记录状态，不能回到活动前。",
      "opening_hook": "能力上的敬意上升，制度上的警惕也上升",
      "ending_button": "E07的局部救援获得可见正回报"
    },
    {
      "binding_id": "ACT-BIND-08",
      "activity_id": "EVT-005",
      "episode_id": "S1-E08",
      "arc_id": "ARC-02",
      "activity": "西湖画舫夜游",
      "historical_anchor": "沿用扩展库 EVT-005 的宋代城市生活形态；具体人物冲突为本剧解释。",
      "interpretation_note": "活动形态取自既有宋代生活活动库，人物选择、具体摊位与冲突属于本剧虚构，不改动 Canon 城市骨架。",
      "season_and_location": {
        "episode_window": [
          "S1-E08"
        ],
        "location_ids": [
          "LOC-007",
          "LOC-010"
        ]
      },
      "modern_emotional_entry": "旅行约会、私人空间边界与城市夜景下的孤独",
      "lead_characters": [
        "CHR-L1-03",
        "CHR-L1-02",
        "CHR-L1-04"
      ],
      "relationship_ids": [
        "REL-002"
      ],
      "surface_goal": "西湖画舫夜游",
      "obstacle": "三条船同时熄灯，船夫只承认自己看见方向不承认意图",
      "relationship_delta": "柳十四用席位和曲目补足周砚之的图证",
      "clue_delta": "周先允许柳解释买画人的社交位置",
      "choice": "一条船驶向不该去的桥下",
      "state_transfer": "旧水图的版本差异被列为后续核验点",
      "continuity_cost": "活动结束后保留人物关系余波、物件或记录状态，不能回到活动前。",
      "opening_hook": "二人关系从欣赏转为允许对方解释自己的专业",
      "ending_button": "失画局部证明地下水道可接仓区"
    },
    {
      "binding_id": "ACT-BIND-09",
      "activity_id": "EVT-016",
      "episode_id": "S1-E09",
      "arc_id": "ARC-02",
      "activity": "香铺合香与药材辨认",
      "historical_anchor": "沿用扩展库 EVT-016 的宋代城市生活形态；具体人物冲突为本剧解释。",
      "interpretation_note": "活动形态取自既有宋代生活活动库，人物选择、具体摊位与冲突属于本剧虚构，不改动 Canon 城市骨架。",
      "season_and_location": {
        "episode_window": [
          "S1-E09"
        ],
        "location_ids": [
          "LOC-016",
          "LOC-003"
        ]
      },
      "modern_emotional_entry": "美妆香水、个人形象、女性劳动与别人如何定义我",
      "lead_characters": [
        "CHR-L2-03",
        "CHR-L2-02",
        "CHR-A1-03"
      ],
      "relationship_ids": [
        "REL-010"
      ],
      "surface_goal": "香铺合香与药材辨认",
      "obstacle": "余仲仁要求青禾先别把少量样本说成疫，阿沅不愿被当成闲话",
      "relationship_delta": "青禾把阿沅记录标为生活观察并保留来源",
      "clue_delta": "她先写‘谁没来’，再写‘可能为何没来’",
      "choice": "同一味白芷在贵宅和小济堂被不同方式囤起",
      "state_transfer": "病例簿增加‘生活观察’栏",
      "continuity_cost": "活动结束后保留人物关系余波、物件或记录状态，不能回到活动前。",
      "opening_hook": "青禾承认生活数据的价值，同时保留医证边界",